<?xml version="1.0" encoding="UTF-8"?>

<!DOCTYPE network SYSTEM "network.dtd">

<network>
	<!-- This is the beastly computer that runs the show -->
	<computer>
		<name>Tropism</name>
		<objective>Core server</objective>
		<arch>i686</arch>
		<os>
			<name>Debian GNU/Linux</name>
			<release>Stable</release>
			<nickname>Woody</nickname>
			<revision>3.0r2</revision>
		</os>
	</computer>
</network>
